{
  "$schema": "./schema.json",
  "version": "1.0.0",
  "language": "de-AT",
  "updated": "2026-09-13",
  "defaults": {
    "captionStyle": "block_2_3",
    "iconStyle": "line",
    "motion": "pop_soft",
    "accent": "accent",
    "priority": 2
  },
  "density": {
    "note": "Regelwerk gegen Icon-Ueberladung. Wenn zu viele Treffer in einem Fenster liegen, gewinnt die hoechste priority; bei Gleichstand der erste Treffer. Alle anderen Treffer behalten die Text-Hervorhebung, verlieren aber das Icon.",
    "maxIconsPer10s": 3,
    "maxIconsPerBlock": 1,
    "minGapBetweenIconsMs": 1200,
    "fallbackWhenSuppressed": "emphasis_only",
    "hookWindowMs": 2000,
    "hookWindowMaxIcons": 1
  },
  "matching": {
    "mode": "word",
    "caseSensitive": false,
    "normalizeUmlauts": false,
    "note": "Wortgrenzen-Match auf den Untertitel-Tokens, nicht auf dem Rohtext. Deutsche Beugung wird ueber inflectionSuffixes abgedeckt; feste Eigennamen (GPT, TikTok) stehen explizit in match und werden nie gebeugt.",
    "inflectionSuffixes": ["", "s", "es", "n", "en", "er", "e", "in", "innen"],
    "compoundMatch": true,
    "compoundNote": "Treffer auch als Teil eines Kompositums: 'Fachkraeftemangel' triggert 'fachkraefte', 'Werbebudget' triggert 'budget'. Icon sitzt am Kompositum, nicht am Teilwort."
  },
  "keywords": [
    { "id": "gpt", "match": ["GPT", "ChatGPT", "Chat GPT", "GPT-5"], "icon": "robot", "category": "ki", "priority": 3, "display": "GPT", "grammar": { "type": "eigenname", "note": "Nie beugen, nie kleinschreiben. 'mit GPT', nicht 'mit dem GPT'." } },
    { "id": "ki", "match": ["KI", "Künstliche Intelligenz", "künstlicher Intelligenz", "AI"], "icon": "sparkle", "category": "ki", "priority": 3, "display": "KI", "grammar": { "type": "nomen", "genus": "f", "artikel": "die", "plural": "die KIs", "note": "Im Deutschen 'KI', nicht 'AI'. Nur bei Marken-/Produktnamen 'AI' stehen lassen." } },
    { "id": "chatbot", "match": ["Chatbot", "Chat-Bot", "Bot"], "icon": "chat", "category": "ki", "priority": 3, "display": "Chatbot", "grammar": { "type": "nomen", "genus": "m", "artikel": "der", "plural": "die Chatbots" } },
    { "id": "automatisierung", "match": ["Automatisierung", "automatisiert", "automatisieren", "Automation"], "icon": "bolt", "category": "ki", "priority": 2, "display": "Automatisierung", "grammar": { "type": "nomen", "genus": "f", "artikel": "die", "plural": "die Automatisierungen" } },
    { "id": "prompt", "match": ["Prompt", "prompten", "Prompt-Engineering"], "icon": "terminal", "category": "ki", "priority": 2, "display": "Prompt", "grammar": { "type": "nomen", "genus": "m", "artikel": "der", "plural": "die Prompts" } },
    { "id": "algorithmus", "match": ["Algorithmus", "Algorithmen"], "icon": "layers", "category": "ki", "priority": 2, "display": "Algorithmus", "grammar": { "type": "nomen", "genus": "m", "artikel": "der", "plural": "die Algorithmen", "note": "Plural ist 'Algorithmen'. 'Algorithmusse' existiert nicht." } },
    { "id": "workflow", "match": ["Workflow", "Prozess", "Prozesse", "Ablauf"], "icon": "repeat", "category": "ki", "priority": 1, "display": "Workflow", "grammar": { "type": "nomen", "genus": "m", "artikel": "der", "plural": "die Workflows" } },

    { "id": "community", "match": ["Community"], "icon": "users", "category": "social", "priority": 3, "display": "Community", "grammar": { "type": "nomen", "genus": "f", "artikel": "die", "plural": "die Communitys", "note": "Deutscher Plural laut Duden: 'Communitys' — nicht 'Communities'." } },
    { "id": "content", "match": ["Content"], "icon": "camera", "category": "social", "priority": 2, "display": "Content", "grammar": { "type": "nomen", "genus": "m", "artikel": "der", "plural": null, "note": "Nur Singular. 'Contents' im Deutschen vermeiden — stattdessen 'Content-Formate' oder 'Beitraege'." } },
    { "id": "reel", "match": ["Reel"], "icon": "play", "category": "social", "priority": 3, "display": "Reel", "grammar": { "type": "nomen", "genus": "n", "artikel": "das", "plural": "die Reels" } },
    { "id": "story", "match": ["Story", "Stories"], "icon": "play", "category": "social", "priority": 1, "display": "Story", "grammar": { "type": "nomen", "genus": "f", "artikel": "die", "plural": "die Storys", "note": "Deutscher Plural: 'Storys'. 'Stories' nur, wenn Instagram-Feature als Eigenname gemeint ist." } },
    { "id": "hook", "match": ["Hook", "Aufhänger", "Einstieg"], "icon": "magnet", "category": "social", "priority": 3, "display": "Hook", "grammar": { "type": "nomen", "genus": "m", "artikel": "der", "plural": "die Hooks" } },
    { "id": "reichweite", "match": ["Reichweite"], "icon": "trending", "category": "social", "priority": 3, "display": "Reichweite", "grammar": { "type": "nomen", "genus": "f", "artikel": "die", "plural": null, "note": "Kein Plural im Marketing-Kontext." } },
    { "id": "follower", "match": ["Follower", "Followerin", "Abonnenten"], "icon": "users", "category": "social", "priority": 2, "display": "Follower", "grammar": { "type": "nomen", "genus": "m", "artikel": "der", "plural": "die Follower", "note": "Plural ohne -s: '10.000 Follower', nicht 'Followers'." } },
    { "id": "viral", "match": ["viral", "Viralität"], "icon": "fire", "category": "social", "priority": 3, "display": "viral", "grammar": { "type": "adjektiv", "note": "Kleinschreibung: 'viral gehen'. Gross nur als Nomen: 'die Viralitaet'." } },
    { "id": "engagement", "match": ["Engagement", "Interaktion", "Interaktionen"], "icon": "heart", "category": "social", "priority": 2, "display": "Engagement", "grammar": { "type": "nomen", "genus": "n", "artikel": "das", "plural": null } },
    { "id": "trend", "match": ["Trend", "Trendthema"], "icon": "fire", "category": "social", "priority": 2, "display": "Trend", "grammar": { "type": "nomen", "genus": "m", "artikel": "der", "plural": "die Trends" } },
    { "id": "sichtbarkeit", "match": ["Sichtbarkeit", "sichtbar"], "icon": "eye", "category": "social", "priority": 2, "display": "Sichtbarkeit", "grammar": { "type": "nomen", "genus": "f", "artikel": "die", "plural": null } },
    { "id": "instagram", "match": ["Instagram", "Insta", "IG"], "icon": "instagram", "category": "social", "priority": 2, "display": "Instagram", "grammar": { "type": "eigenname", "note": "Immer 'Instagram' ausschreiben im Untertitel. 'Insta' nur, wenn es so gesprochen wird." } },
    { "id": "tiktok", "match": ["TikTok", "Tik Tok"], "icon": "tiktok", "category": "social", "priority": 2, "display": "TikTok", "grammar": { "type": "eigenname", "note": "Binnenmajuskel: TikTok. Nicht 'Tiktok', nicht 'TIKTOK'." } },
    { "id": "linkedin", "match": ["LinkedIn", "Linked In"], "icon": "linkedin", "category": "social", "priority": 2, "display": "LinkedIn", "grammar": { "type": "eigenname", "note": "Binnenmajuskel: LinkedIn." } },

    { "id": "bewerber", "match": ["Bewerber", "Bewerberin", "Kandidat", "Kandidatin"], "icon": "user-check", "category": "recruiting", "priority": 3, "display": "Bewerber", "grammar": { "type": "nomen", "genus": "m", "artikel": "der", "plural": "die Bewerber", "note": "Plural identisch mit Singular. Gendern optional — wenn, dann konsequent im ganzen Video: 'Bewerber:innen'." } },
    { "id": "bewerbung", "match": ["Bewerbung", "Bewerbungen"], "icon": "document", "category": "recruiting", "priority": 2, "display": "Bewerbung", "grammar": { "type": "nomen", "genus": "f", "artikel": "die", "plural": "die Bewerbungen" } },
    { "id": "recruiting", "match": ["Recruiting", "Recruitment", "Personalsuche", "Mitarbeitersuche"], "icon": "search", "category": "recruiting", "priority": 3, "display": "Recruiting", "grammar": { "type": "nomen", "genus": "n", "artikel": "das", "plural": null } },
    { "id": "mitarbeiter", "match": ["Mitarbeiter", "Mitarbeiterin", "Mitarbeitende", "Personal"], "icon": "users", "category": "recruiting", "priority": 3, "display": "Mitarbeiter", "grammar": { "type": "nomen", "genus": "m", "artikel": "der", "plural": "die Mitarbeiter" } },
    { "id": "fachkraefte", "match": ["Fachkraft", "Fachkräfte", "Fachkräftemangel", "Personalmangel"], "icon": "wrench", "category": "recruiting", "priority": 3, "display": "Fachkräfte", "grammar": { "type": "nomen", "genus": "f", "artikel": "die", "plural": "die Fachkräfte", "note": "Umlaut im Plural: Fachkraft → Fachkraefte." } },
    { "id": "job", "match": ["Job", "Stelle", "Stellen", "Position"], "icon": "briefcase", "category": "recruiting", "priority": 3, "display": "Job", "grammar": { "type": "nomen", "genus": "m", "artikel": "der", "plural": "die Jobs" } },
    { "id": "team", "match": ["Team"], "icon": "users", "category": "recruiting", "priority": 2, "display": "Team", "grammar": { "type": "nomen", "genus": "n", "artikel": "das", "plural": "die Teams" } },
    { "id": "lebenslauf", "match": ["Lebenslauf", "Lebensläufe", "CV"], "icon": "document", "category": "recruiting", "priority": 2, "display": "Lebenslauf", "grammar": { "type": "nomen", "genus": "m", "artikel": "der", "plural": "die Lebensläufe" } },
    { "id": "vorstellungsgespraech", "match": ["Vorstellungsgespräch", "Bewerbungsgespräch", "Interview"], "icon": "calendar", "category": "recruiting", "priority": 2, "display": "Vorstellungsgespräch", "grammar": { "type": "nomen", "genus": "n", "artikel": "das", "plural": "die Vorstellungsgespräche" } },
    { "id": "lehre", "match": ["Lehre", "Lehrling", "Lehrlinge", "Ausbildung"], "icon": "graduation", "category": "recruiting", "priority": 2, "display": "Lehre", "grammar": { "type": "nomen", "genus": "f", "artikel": "die", "plural": "die Lehren", "note": "AT-Begriff. In DE-Zielgruppen 'Ausbildung' verwenden." } },